Name,Description,Latitude,Longitude,InfoURL,ImageURL
UCSB,A great university located along the California Coast!,34.416929,-119.845991,"https://en.wikipedia.org/wiki/University_of_California,_Santa_Barbara",https://web.physics.ucsb.edu/~Women/images/ucsb-big.jpg
Leo J. Ryan Park,A great place for walks and boat rides along the Foster City lagoon.,37.55635,-122.26894,https://en.wikipedia.org/wiki/Leo_J._Ryan_Memorial_Park,https://upload.wikimedia.org/wikipedia/commons/d/d0/Leo_J._Ryan_Memorial_Park-4.jpg
Coyote Point Recreation Area,"Beautiful area with lots of trees, a harbor, museums, and a playground for kids.",37.585916,-122.3266472,https://en.wikipedia.org/wiki/Coyote_Point_Recreation_Area,https://upload.wikimedia.org/wikipedia/commons/b/b3/2009_04_19_lax-sfo_428_%283541390673%29.jpg
Muir Woods National Monument,A national park filled with tall redwood trees and good hiking trails.,37.8918548,-122.5691758,https://en.wikipedia.org/wiki/Muir_Woods_National_Monument,https://upload.wikimedia.org/wikipedia/commons/4/4e/Northern_California_Muir_Woods_-_National_Monument.jpg
Hillsdale Shopping Center,"A large mall with plenty of different shops and events, as well as a relatively new food court.",37.5375466,-122.3026782,https://en.wikipedia.org/wiki/Hillsdale_Shopping_Center,https://upload.wikimedia.org/wikipedia/commons/e/e0/Hillsdale_Shopping_Center_-_exterior_1_2022-07-16.jpeg
Pier 39,A shopping center and a pier that is often visited by people and sea lions alike.,37.8083474,-122.4104266,https://en.wikipedia.org/wiki/Pier_39,https://upload.wikimedia.org/wikipedia/commons/6/65/Pier_39_in_2021.jpg